とおりかかる,to happen to pass by,通りかかる,Godan verb with ru ending; Transitive verb; intransitive verb
あたい,price; cost; value; worth; merit; value,値,Noun; No-adjective
ひ,light; lamp; torch,灯,Noun
かん,pipe; tube,管,Noun; Noun - used as a suffix
いち,market; fair,市,Noun
のこぎり,saw; musical saw; Nokogiri,鋸,Noun; Place
ふたり,two persons; two people; pair; couple,二人,Noun
もん,gate; branch of learning based on the teachings of a single master; division; phylum; counter for cannons,門,Noun; Noun - used as a suffix; Counter
いりぐち,entrance; entry; gate; approach,入口,Noun; No-adjective
こなごな,in very small pieces,粉々,Na-adjective; Noun
のがす,to miss (e.g. a chance); to lose; to let get away; to set free; to let go; to fail to ...,逃す,Godan verb with su ending; Transitive verb; Auxiliary verb
でくわす,to happen to meet; to come across,出くわす,Godan verb with su ending; intransitive verb
こぜに,small change; coins; small sum of money,小銭,Noun
むすびつける,to combine; to join; to tie on; to attach with a knot,結び付ける,Ichidan verb; Transitive verb
つかえる,to serve; to work for; to attend,仕える,Ichidan verb; intransitive verb
