かざり,decoration,飾り,Noun; Noun - used as a suffix
いんりょく,"attraction (e.g. magnetic, gravitation); affinity; gravitational pull; attractiveness; magnetism",引力,Noun
ひきとめる,to detain; to check; to restrain,引き止める,Ichidan verb; Transitive verb
そうぞうしい,noisy; loud; boisterous; clamorous; turbulent; unsettled; restless,騒々しい,I-adjective
げひん,vulgar; indecent; coarse; crude,下品,Na-adjective; Noun
そくたつ,express; special delivery,速達,Noun; Suru verb
ためいき,sigh,ため息,Noun
ふける,to get late; to advance; to wear on,更ける,Ichidan verb; intransitive verb
ねっする,to heat; to heat up,熱する,Suru verb - special class
おもたい,"heavy; weighty; heavy (feeling, atmosphere, etc.); serious; gloomy; depressing",重たい,I-adjective
とかす,to dissolve; to melt,溶かす,Godan verb with su ending; Transitive verb
まざる,to be mixed; to be blended with; to associate with; to mingle with,混ざる,Godan verb with ru ending; intransitive verb
ぬらす,to wet; to moisten; to dampen; to soak,濡らす,Godan verb with su ending; Transitive verb
さぐる,to feel around for; to fumble for; to grope for; to search for; to investigate; to probe into; to spy on; to sound out; to explore (parts unknown),探る,Godan verb with ru ending; Transitive verb
たんしょ,defect; demerit; weak point; disadvantage,短所,Noun
きせる,to put clothes on (someone); to plate; to gild; to veneer; to accuse (of some crime); to give (a bad name),着せる,Ichidan verb; Transitive verb
とだな,cupboard; locker; closet; wardrobe,戸棚,Noun
ひろめる,to spread; to propagate; to popularize; to disseminate; to broaden; to extend; to widen; to enlarge,広める,Ichidan verb; Transitive verb
ちらかす,to scatter around; to leave untidy,散らかす,Godan verb with su ending; Transitive verb
ととのう,to be ready; to be prepared; to be arranged; to be in order; to be put in order; to be well-ordered; to be well-proportioned; to be adjusted,整う,Godan verb with u ending; intransitive verb
とりいれる,to harvest; to reap; to take in; to gather in; to adopt (e.g. idea); to accept (e.g. advice); to introduce; to borrow (e.g. word),取り入れる,Ichidan verb; Transitive verb
ちぢむ,to shrink; to contract; to diminish (in size),縮む,Godan verb with mu ending; intransitive verb
にえる,to be boiled; to be cooked,煮える,Ichidan verb; intransitive verb
すえっこ,youngest child,末っ子,Noun
あてはめる,to apply; to adapt,当てはめる,Ichidan verb; Transitive verb
